source,author,title,description,published_date,url,publish_hour,publish_date
anfieldindex.com,anfield index,journalist: liverpool have set their sights on move for forward with ‘ridiculous’ numbers,"liverpool transfer news: yan diomande, bradley barcola and a summer built around wingerson anfield index’s media matters podcast, dave davis and david lynch moved from the emotion of liverpool’s f...",2026-05-25 17:25:00+00:00,https://anfieldindex.com/94486/journalist-liverpool-have-set-their-sights-on-move-for-forward-with-ridiculous-numbers.html,17,2026-05-25
theflightdeal.com,the flight deal,"scandinavian airlines: san francisco – warsaw, poland. $660 (basic economy) / $760 (regular economy). roundtrip, including all taxes",a good sale to warsaw.matrix airfare search by ita software will price this at $674 (basic economy). use those dates on  scandinavian should reprice to $660 (basic economy) / $760 (regular econom,2026-05-25 17:23:40+00:00,https://www.theflightdeal.com/2026/05/25/scandinavian-airlines-san-francisco-warsaw-poland-660-basic-economy-760-regular-economy-roundtrip-including-all-taxes/,17,2026-05-25
wnd.com,robert knight,will democrat wrongdoers ever face justice?,'we have a huge institutional memory hole thanks to a legacy media controlled by leftists',2026-05-25 17:22:19+00:00,https://www.wnd.com/2026/05/will-democrat-wrongdoers-ever-face-justice/,17,2026-05-25
fox business,fox business,raaw energy issues recall on dozens of products over listeria fears,a popular raw dog food brand is expanding a recall of dozens of products over fears they may be contaminated with listeria monocytogenes.,2026-05-25 17:21:24+00:00,https://www.foxbusiness.com/lifestyle/popular-pet-food-brand-halts-production-after-fda-warns-possible-dangerous-contamination,17,2026-05-25
twistedsifter.com,matthew gilligan,they thought their new job was going fine until they were suddenly fired after only a week,"maybe it's a good thing it didn't work out if they were gonna get treated this way...
the post they thought their new job was going fine until they were suddenly fired after only a week appeared first on twistedsifter.",2026-05-25 17:21:18+00:00,http://twistedsifter.com/2026/05/they-thought-their-new-job-was-going-fine-until-they-were-suddenly-fired-after-only-a-week/,17,2026-05-25
deadline,matthewgrobar,“the evolution of late night is here”: ben gleib talks launching world’s first youtube-native late-night talk show from his house – comedy means business podcast,"with late night at a crossroads, ben gleib is forging a new path. just a week after the permanent shuttering of the late show — the cbs franchise hosted for the last 11 years by stephen colbert — gleib is poised to launch good night with ben gleib, which mark…",2026-05-25 17:20:00+00:00,http://deadline.com/2026/05/ben-gleib-youtube-talk-show-comedy-means-business-podcast-1236920336/,17,2026-05-25
yahoo entertainment,unknown,jim cramer reveals why international business machines (ibm) should be doing better,no description,2026-05-25 17:17:45+00:00,https://consent.yahoo.com/v2/collectconsent?sessionid=1_cc-session_605e8c57-d2c7-4b09-98c4-298b8326ea56,17,2026-05-25
/film,staff@slashfilm.com (nina starner),"euphoria season 3, episode 7 kills off one of the show's main characters","one of the main characters in euphoria dies in season 3, episode 7, and we need to talk about how they ultimately meet their maker.",2026-05-25 17:14:00+00:00,https://www.slashfilm.com/2180636/euphoria-season-3-episode-7-nate-jacobs-death-explained/,17,2026-05-25
theflightdeal.com,the flight deal,"american: philadelphia – san jose, costa rica. $374 (basic economy) / $456 (regular economy). roundtrip, including all taxes","a good sale to san jose, costa rica. pricing will vary slightly depending on routing.the $456 fare is the regular fare which allows for normal size carry-on and one personal item in addition to ad",2026-05-25 17:13:42+00:00,https://www.theflightdeal.com/2026/05/25/american-philadelphia-san-jose-costa-rica-374-basic-economy-456-regular-economy-roundtrip-including-all-taxes/,17,2026-05-25
business insider,kelly burch,"i didn't want to work in my family's warehouse business. after 14 years, i can't imagine leaving.",ryan saltzman joined his family's wholesale grocery business after college and now helps lead the century-old company.,2026-05-25 17:09:01+00:00,https://www.businessinsider.com/joined-family-business-wholesale-grocery-company-2026-5,17,2026-05-25
boston.com,peter chianca,"review and setlist: bruce springsteen at td garden, boston, 5/24/26","bruce springsteen's td garden show functioned as a political rally, a call to action, and a reminder about civic responsibility.",2026-05-25 17:06:40+00:00,https://www.boston.com/culture/concert-reviews/2026/05/25/review-and-setlist-bruce-springsteen-e-street-band-td-garden-boston-may-24-2026/,17,2026-05-25
pypi.org,sofeykov@gmail.com,ezrules 1.23.0,open-source transaction monitoring engine for business rules,2026-05-25 17:06:21+00:00,https://pypi.org/project/ezrules/1.23.0/,17,2026-05-25
the times of india,pti,"bsnl revenue rises 19% to rs 25,000 crore in two years; tariff cheaper than pvt telcos: mos telecom","state-owned bsnl has seen a significant revenue jump of 19 percent, reaching rs 25,000 crore in two years. this financial turnaround is attributed to improved infrastructure and operational efficiency. the company's ebitda has also seen a dramatic increase.",2026-05-25 17:06:19+00:00,https://economictimes.indiatimes.com/industry/telecom/telecom-news/bsnl-revenue-rises-19-to-rs-25000-crore-in-two-years-tariff-cheaper-than-pvt-telcos-mos-telecom/articleshow/131314086.cms,17,2026-05-25
fox news,unknown,canadian teen girl charged with arson after allegedly torching american baseball team's charter bus,"a canadian teen is charged with arson after allegedly setting fire to a u.s. baseball team's charter bus during a road trip to winnipeg, police say.",2026-05-25 17:04:50+00:00,https://www.foxnews.com/world/canadian-teen-girl-charged-arson-allegedly-torching-american-baseball-teams-charter-bus,17,2026-05-25
coindesk,"francisco rodrigues, ai boost","indonesia blocks polymarket, calling prediction market online gambling in disguise",authorities stated that using crypto or blockchain doesn't change platforms that let users wager on uncertain outcomes from being gambling products.,2026-05-25 17:04:49+00:00,https://www.coindesk.com/policy/2026/05/25/indonesia-blocks-polymarket-calling-prediction-market-online-gambling-in-disguise,17,2026-05-25
popular science,margherita bassi,bobcat that survived being hit by a car gets a custom-built kennel,"a generous donation and a good neighbor will help the wildcat continue her recovery.
the post bobcat that survived being hit by a car gets a custom-built kennel appeared first on popular science.",2026-05-25 17:04:00+00:00,http://www.popsci.com/environment/bobcat-custom-kennel-recovery/,17,2026-05-25
theflightdeal.com,the flight deal,"delta: seattle – gothenburg, sweden. $494 (basic economy) / $714 (regular economy). roundtrip, including all taxes","a good sale to gothenburg. pricing will vary slightly depending on routing.the $714 fare includes advance seat assignment, a normal size carry-on and one checked bag.delta / air france / klm r",2026-05-25 17:03:04+00:00,https://www.theflightdeal.com/2026/05/25/delta-seattle-gothenburg-sweden-494-basic-economy-714-regular-economy-roundtrip-including-all-taxes/,17,2026-05-25
the times of india,das narayandas,"india produces talent, but does it build it?","india has world-class talent in engineering, management and entrepreneurship, but indian companies still often treat people as easily replaceable rather than long-term assets, according to a harvard business school professor.",2026-05-25 17:02:51+00:00,https://economictimes.indiatimes.com/opinion/et-commentary/india-produces-talent-but-does-it-build-it/articleshow/131313962.cms,17,2026-05-25
hacker news,unknown,rentflow (yc s24) is hiring,"about rentflow

rentflow is tackling a hair-on-fire problem for small and medium businesses across the u.s.: the way their rent is paid
each month is fundamentally misaligned with how cash actually comes in.

we’re building the infrastructure layer to fix tha…",2026-05-25 17:00:27+00:00,https://www.ycombinator.com/companies/rentflow/jobs/v2yneie-senior-ai-ml-lead,17,2026-05-25
new zealand herald,jenée tibshraeny,budget 2026 to include more cuts and reprioritisations than sweeteners – jenée tibshraeny,analysis: nicola willis will try to prevent nz's finances from worsening in the budget.,2026-05-25 17:00:00+00:00,https://www.nzherald.co.nz/business/economy/budget-2026-to-include-more-cuts-and-reprioritisations-than-sweeteners-jenee-tibshraeny/premium/kddtgpsghrhvtck2tcxof77l5m/,17,2026-05-25
new zealand herald,zoe mills,waioweka gorge closures disrupt $190m in tradeable gdp a year: report,trust tairāwhiti report finds unreliable access a 'major economic resilience risk'.,2026-05-25 17:00:00+00:00,https://www.nzherald.co.nz/gisborne-herald/news/waioweka-gorge-closures-disrupt-190m-in-tradeable-gdp-a-year-report/umzskllo7reo5be54luyatjimi/,17,2026-05-25
new zealand herald,kevin page,from the kitchen to the couch: hospital drama wins a surprised new fan – kevin page,"opinion: 'we have, on occasion, had to remind ourselves that they are not real.'",2026-05-25 17:00:00+00:00,https://www.nzherald.co.nz/whanganui-chronicle/news/from-the-kitchen-to-the-couch-hospital-drama-wins-a-surprised-new-fan-kevin-page/premium/juy4kintnbgcnjovr6b3kwlm3u/,17,2026-05-25
new zealand herald,anne gibson,property insider: fast-track approvals see 14 major projects pushed through under coalition scheme,what and where are the projects which have won approval since february this year?,2026-05-25 17:00:00+00:00,https://www.nzherald.co.nz/property/property-insider-fast-track-approvals-see-14-major-projects-pushed-through-under-coalition-scheme/premium/jubejz5y2nhmle3qqpfrmfosky/,17,2026-05-25
new zealand herald,varsha anjali,how much does auckland earn?,the herald asks aucklanders how much money they make and how they feel about it.,2026-05-25 17:00:00+00:00,https://www.nzherald.co.nz/lifestyle/how-much-does-auckland-earn/premium/hauzuxx6gvhurbb7emn2pyv524/,17,2026-05-25
debugbear.com,jakub andrzejewski,smarter website caching with no-vary-search,"learn how no-vary-search improves caching for urls with query parameters. this article explains how the header works, when it increases cache efficiency, and when to avoid it.",2026-05-25 17:00:00+00:00,https://www.debugbear.com/blog/no-vary-search,17,2026-05-25
globenewswire,delveinsight business research llp,emerging hope in multiple myeloma market: 7 late-stage therapies nearing the finish line | delveinsight,"the multiple myeloma market is evolving toward immunotherapy-dominated, multi-line treatment paradigms with strong growth driven by car-t and bispecific antibodies. leading contenders advancing through the pipeline include azd0120 [astrazeneca (gracell biotec…",2026-05-25 17:00:00+00:00,https://www.globenewswire.com/news-release/2026/05/25/3300693/0/en/emerging-hope-in-multiple-myeloma-market-7-late-stage-therapies-nearing-the-finish-line-delveinsight.html,17,2026-05-25
new zealand herald,derek cheng,national is bleeding votes to nz first. can it win them back? - derek cheng,analysis: rival strategists simeon brown and shane jones outline their parties' campaigns.,2026-05-25 17:00:00+00:00,https://www.nzherald.co.nz/nz/politics/national-is-bleeding-votes-to-nz-first-can-it-win-them-back-derek-cheng/premium/uty33kmayfdnzcwe5vl7yhgbwe/,17,2026-05-25
the irish times,owen doyle,owen doyle: referees get an armchair ride as leinster and ulster crash and burn,"discipline, defence and breakdown decisions shape european deciders for leinster and ulster",2026-05-25 16:59:17+00:00,https://www.irishtimes.com/sport/rugby/2026/05/25/owen-doyle-referees-get-an-armchair-ride-as-leinster-and-ulster-crash-and-burn/,16,2026-05-25
the irish times,owen doyle,owen doyle: leinster left chasing shadows in champions cup final defeat,"discipline, defence and breakdown decisions shape european deciders for leinster and ulster",2026-05-25 16:59:17+00:00,https://www.irishtimes.com/sport/rugby/2026/05/25/owen-doyle-leinster-left-chasing-shadows-in-champions-cup-final-defeat/,16,2026-05-25
prnewswire,unknown,vinfast names mr. pham nhat quan anh as chairman of the board of directors,"singapore, may 25, 2026 /prnewswire/ -- vinfast auto ltd. (""vinfast"" or the ""company"") announced that its board of directors has appointed mr. pham nhat quan anh as chairman of the board of the company. the appointment is intended to support the company's glo…",2026-05-25 16:54:00+00:00,https://www.prnewswire.com/news-releases/vinfast-names-mr-pham-nhat-quan-anh-as-chairman-of-the-board-of-directors-302781237.html,16,2026-05-25
theflightdeal.com,the flight deal,"scandinavian airlines: los angeles – prague, czechia. $598 (basic economy) / $698 (regular economy). roundtrip, including all taxes",a good sale to praguematrix airfare search by ita software will price this at $612 (basic economy). use those dates on  scandinavian should reprice to $598 (basic economy) / $698 (regular economy,2026-05-25 16:53:48+00:00,https://www.theflightdeal.com/2026/05/25/scandinavian-airlines-los-angeles-prague-czechia-598-basic-economy-698-regular-economy-roundtrip-including-all-taxes/,16,2026-05-25
cbc news,unknown,peel police make 17 arrests in extortion investigation targeting south asian businesses,"peel police say 17 suspects have been arrested after an investigation into a string of violent extortion incidents that predominantly targeted south asian businesses in brampton, caledon and mississauga.",2026-05-25 16:52:58+00:00,https://www.cbc.ca/news/canada/toronto/peel-police-extortion-arrests-south-asian-businesses-9.7211288,16,2026-05-25
liberianobserver.com,,american businesses in liberia unite to form new association,"established to strengthen us-liberia economic ties through investments, advocacy, and collaboration among american businesses in liberia, led by mr. abraham avi zaidenberg.",2026-05-25 16:52:36+00:00,https://www.liberianobserver.com/business/american-businesses-in-liberia-unite-to-form-new-association/article_0b073600-8884-4c24-ab16-c2631f5480d3.html,16,2026-05-25
crooksandliars.com,chris capper liebenthal,rep. thomas massie promises to remain a thorn in trump's side,"mike lindell, the mypillow guy, has announced he will file a claim with the trump sedition fund. lindell said that he had three separate companies - although he does not name the companies or what kind of business they are in -look into mypillow's finances, a…",2026-05-25 16:50:49+00:00,https://crooksandliars.com/2026/05/lindell-eyes-trumps-sedition-slush-fund,16,2026-05-25
livemint,eshita gain,freelancer tax guide: how to report overseas client income and pay taxes in india,"freelancers in india earning from foreign clients must report this income on their tax returns, as it is fully taxable. they can opt for presumptive taxation under section 44ada if conditions are met. details here.&nbsp;",2026-05-25 16:49:01+00:00,https://www.livemint.com/money/personal-finance/freelancer-tax-guide-how-to-report-overseas-client-income-and-pay-taxes-in-india-11779724942605.html,16,2026-05-25
the punch,punch newspapers,yasam ayavefe strengthens long-term investment vision through disciplined global portfolio growth,"discover yasam ayavefe’s disciplined approach to global portfolio growth, focusing on long-term investment, operational depth, and sustainable value creati

read more: https://punchng.com/yasam-ayavefe-strengthens-long-term-investment-vision-through-disciplin…",2026-05-25 16:46:13+00:00,https://punchng.com/yasam-ayavefe-strengthens-long-term-investment-vision-through-disciplined-global-portfolio-growth/,16,2026-05-25
fortune,the associated press,memorial day is 161 years old — and its true origin was buried almost immediately,"memorial day is a u.s. holiday that is officially about mourning the nation’s fallen service members, but it has come to signal the unofficial start of summer and a long weekend of travel and discounts on anything from mattresses to lawn mowers. here is a loo…",2026-05-25 16:46:06+00:00,https://fortune.com/2026/05/25/what-is-history-of-memorial-day-why-civil-war/,16,2026-05-25
financial post,business wire,larimar positions itself at sima as a benchmark for international real estate investment,"larimar city & resort’s participation at sima 2026 concluded with a highly positive outcome, driven by strong interest from investors, operators, and international real estate professionals. the project strengthens its value proposition based on profitability…",2026-05-25 16:45:37+00:00,https://financialpost.com/pmn/business-wire-news-releases-pmn/larimar-positions-itself-at-sima-as-a-benchmark-for-international-real-estate-investment,16,2026-05-25
vikings territory,dustin baker,bleacher recommends final offseason move for vikings,"the minnesota vikings exercised jordan addison’s fifth-year option earlier this month, and it’s time for the franchise to formally extend […]",2026-05-25 16:45:00+00:00,https://vikingsterritory.com/2026/news/top_news/vikings-addison-contract-move,16,2026-05-25
theflightdeal.com,the flight deal,"korean air: dallas – manila, philippines. $919. roundtrip, including all taxes","a good sale to manilasample travel date:august 27th - september 3rdthis is just one sample travel date, for more availability, please follow the ""fare availability"" and ""ho",2026-05-25 16:43:52+00:00,https://www.theflightdeal.com/2026/05/25/korean-air-dallas-manila-philippines-919-roundtrip-including-all-taxes/,16,2026-05-25
businessline,pti,bsnl revenue jumps 19% in two years on infrastructure improvements,"bsnl’s revenue has risen to ₹25,000 crore in two years, while ebitda surged to nearly ₹7,000 crore amid infrastructure upgrades and 4g rollout.",2026-05-25 16:43:10+00:00,https://www.thehindubusinessline.com/info-tech/bsnl-revenue-jumps-19-in-two-years-on-infrastructure-improvements/article71022471.ece,16,2026-05-25
ibtimes.com.au,jason taylor,blake lively and ryan reynolds face $2.1 million contractor liens on expansive new york estate,"blake lively and ryan reynolds face $2.1 million in contractor liens on their eco-friendly lewisboro estate, highlighting the complexities of celebrity construction projects.",2026-05-25 16:40:53+00:00,https://www.ibtimes.com.au/blake-lively-ryan-reynolds-eco-friendly-estate-liens-1869468,16,2026-05-25
addicted2success.com,joel brown (founder of addicted2success.com),the hidden addiction that’s quietly destroying most coaches and consultants (and the one shift that finally sets you free),"you’re damn good at what you do. clients have breakthroughs. they send you the late-night voice notes about how you changed their life. some even credit you with saving their marriage, their business, or their sanity. yet here you are… exhausted, trading hour…",2026-05-25 16:40:16+00:00,https://addicted2success.com/success-advice/coaches-and-consultants-hidden-addiction/,16,2026-05-25
slashdot.org,theodp,code.org co-founder pivots from k-12 cs and ai education to piano lessons,"not long after pivoting his tech-backed nonprofit code.org's mission from k-12 cs education to include ai literacy late last year, code.org co-founder hadi partovi announced he was officially stepping down as ceo of the tech-backed nonprofit, explaining: ""for…",2026-05-25 16:39:51+00:00,https://slashdot.org/submission/17347548/codeorg-co-founder-pivots-from-k-12-cs-and-ai-education-to-piano-lessons,16,2026-05-25
britbrief.co.uk,british brief,"bhp defies climate strategy, spends $500m on polluting diesel trucks","stay informed with british brief. breaking uk and international news covering politics, entertainment, sports, technology, business, health and more. the latest stories delivered daily.. british brief",2026-05-25 16:38:45+00:00,https://britbrief.co.uk/business/economy/bhp-defies-climate-strategy-spends-500m-on-diesel-trucks.html,16,2026-05-25
