source,author,title,description,published_date,url,publish_hour,publish_date
theflightdeal.com,the flight deal,"delta: portland – copenhagen, denmark. $530 (basic economy) / $750 (regular economy). roundtrip, including all taxes","a good sale to copenhagen. pricing will vary slightly depending on routing.the $750 fare includes advance seat assignment, normal size carry-on and one checked bag.delta / air france / klm roy",2026-05-25 18:23:44+00:00,https://www.theflightdeal.com/2026/05/25/delta-portland-copenhagen-denmark-530-basic-economy-750-regular-economy-roundtrip-including-all-taxes/,18,2026-05-25
twistedsifter.com,heather hall,volleyball player exploits loophole in recreational league’s “unchangeable roster” rule,"sometimes you have to work with what the rules allow.
the post volleyball player exploits loophole in recreational league’s “unchangeable roster” rule appeared first on twistedsifter.",2026-05-25 18:22:44+00:00,http://twistedsifter.com/2026/05/volleyball-player-exploits-loophole-in-recreational-leagues-unchangeable-roster-rule/,18,2026-05-25
bmwblog,horatiu boeriu,the bmw m engine that ended up in a land rover,"bmw’s s68 is a 4.4-liter twin-turbocharged v8 — and it’s now in more places than you might expect. when bmw replaced its long-running n63 with an all-new engine in 2022, it made an unusual call:...
first published by https://www.bmwblog.com",2026-05-25 18:20:19+00:00,https://www.bmwblog.com/2026/05/25/cars-with-bmw-s68-engine/,18,2026-05-25
pbs,associated press,the origins of memorial day and how it has evolved,"memorial day is a u.s. holiday that is officially about mourning the nation's fallen service members, but it has come to signal the unofficial start of summer and a long weekend of travel, as well as discounts on anything from mattresses to lawn mowers.",2026-05-25 18:19:02+00:00,https://www.pbs.org/newshour/nation/the-origins-of-memorial-day-and-how-it-has-evolved,18,2026-05-25
theflightdeal.com,the flight deal,"american: phoenix – liberia, costa rica. $436 (basic economy) / $544 (regular economy). roundtrip, including all taxes",a good sale to the guanacaste province of costa rica.the $544 fare is the regular fare which allows for normal size carry-on and one personal item in addition to advance seat assignment.americ,2026-05-25 18:18:59+00:00,https://www.theflightdeal.com/2026/05/25/american-phoenix-liberia-costa-rica-436-basic-economy-544-regular-economy-roundtrip-including-all-taxes/,18,2026-05-25
variety,angelique jackson,"wendell pierce challenged himself to an annual acting trifecta. now he’s starring in a ‘jack ryan’ movie, ‘elsbeth’ and ‘othello’ all at once","in 2019, wendell pierce was walking through london’s piccadilly circus to make it to that night’s performance of “death of a salesman,” when he stumbled upon a massive billboard. the ad was for the latest season of “jack ryan,” the prime video series in which…",2026-05-25 18:18:59+00:00,https://variety.com/2026/film/features/wendell-pierce-jack-ryan-movie-elsbeth-othello-power-raising-kanan-1236755962/,18,2026-05-25
bgr,staff@bgr.com (andrew morrisey),how many of these 5 extinct pc brands do you actually remember?,"there have been plenty of pc brands over the years that have gone extinct, with names like compaq and gateway among those you might have forgotten about.",2026-05-25 18:17:00+00:00,https://www.bgr.com/2176496/how-many-of-these-extinct-pc-brands-do-you-remember/,18,2026-05-25
dailymail.com,codie bullen,love island signs first-class criminology graduate as bosses reveal glamorous new islander,"love island bosses have signed up a stunning criminology graduate for the 2026 series, with itv insiders said to be 'excited' about her arrival in the villa.",2026-05-25 18:16:55+00:00,https://www.dailymail.com/tvshowbiz/article-15847005/love-island-criminology-graduate-glamorous-new-islander.html,18,2026-05-25
cbs sports,sam quinn,lakers begin front office restructuring by hiring 'literal rocket scientist' rohan ramadas as assistant gm,the lakers are shifting gears away from family business under new owner mark walter,2026-05-25 18:12:59+00:00,https://www.cbssports.com/nba/news/lakers-front-office-rohan-ramadas-assistant-gm/,18,2026-05-25
the daily caller,hudson crozier,"how doj, texas won ‘head-on-the-spike’ victory against sex-change industry",a texas hospital's court settlement with conservative officials brings a lengthy legal campaign against the sex-change industry to a crescendo.,2026-05-25 18:12:37+00:00,https://dailycaller.com/2026/05/25/how-doj-texas-won-head-on-the-spike-victory-against-sex-change-industry/,18,2026-05-25
the times of india,dipanjan roy chaudhury,myanmar president to arrive on sunday on first foreign visit,"myanmar president min aung hlaing will visit india this sunday. this marks his first foreign trip since becoming president in april. the visit underscores myanmar's view of india as a key partner for development, business, and regional security. india sees th…",2026-05-25 18:12:11+00:00,https://economictimes.indiatimes.com/news/india/myanmar-president-to-arrive-on-sunday-on-first-foreign-visit/articleshow/131315564.cms,18,2026-05-25
boredpanda.com,pratik handore,“i was absolutely desperate”: christopher nolan defends shocking ‘the odyssey’ casting despite actress’s confession,christopher nolan defends lupita nyong'o casting in the odyssey amid online backlash.,2026-05-25 18:10:35+00:00,https://www.boredpanda.com/i-was-absolutely-desperate-christopher-nolan-defends-shocking-the-odyssey-casting-despite-actresss-confession/,18,2026-05-25
cryptoslate,liam 'akiba' wright,cftc may gain broader crypto oversight as staff who questioned major firms were reportedly sidelined,"cftc crypto oversight is moving toward a larger role under the clarity act, but the agency that congress may soon ask to police much of the us crypto market is facing a more immediate test of its own independence. a new york times investigation reported that …",2026-05-25 18:10:24+00:00,https://cryptoslate.com/cftc-crypto-oversight-clarity-act-independence-test/,18,2026-05-25
forbes,"david bloom, senior contributor, 
 david bloom, senior contributor
 https://www.forbes.com/sites/dbloom/",building a world class creative tech hub in vancouver,"the los angeles film industry is struggling, but vancouver's similar sector is thriving with a mix of industry attention, government support and educational pipelines.",2026-05-25 18:09:42+00:00,https://www.forbes.com/sites/dbloom/2026/05/25/building-a-world-class-creative-tech-hub-in-vancouver/,18,2026-05-25
the times of india,piyush shukla,"the abraham accords: the boldest middle east gamble in decades, did it actually work? here's all about it","abraham accords: trump just called six muslim nations to sign the abraham accords — live, out loud, tied to an iran nuclear deal. pakistan said no. the rest went silent. this is the biggest middle east normalization push since 2020. and the world is watching …",2026-05-25 18:06:48+00:00,https://economictimes.indiatimes.com/news/international/us/the-abraham-accords-the-boldest-middle-east-gamble-in-decades-did-it-actually-work-heres-all-about-it/articleshow/131315385.cms,18,2026-05-25
prnewswire,unknown,rotoplas publishes its 2025 sustainable development impact disclosure (sdid),"mexico city, may 25, 2026 /prnewswire/ -- grupo rotoplas, s.a.b. de c.v. (bmv: agua*) (""rotoplas"" or ""the company""), leader in water management solutions in the americas, informs the investing public that today it published its 2025 sustainable development im…",2026-05-25 18:06:00+00:00,https://www.prnewswire.com/news-releases/rotoplas-publishes-its-2025-sustainable-development-impact-disclosure-sdid-302781265.html,18,2026-05-25
new york post,titus wu,gavin newsom quietly takes key step to cementing 2028 bid support from powerhouse dem,"newsom took a major step to woo warren when he appointed one of the senator's protégés, rohit chopra, to lead a new consumer agency.",2026-05-25 18:04:05+00:00,https://nypost.com/2026/05/25/us-news/gavin-newsom-quietly-takes-key-step-to-cementing-2028-bid-support-from-powerhouse-dem/,18,2026-05-25
prnewswire,unknown,"acts law, becker law group, nguyen lawyers partner together in fight for garden grove chemical spill victims","garden grove, calif., may 25, 2026 /prnewswire/ -- three premier los angeles law firms, acts law, becker law group and nguyen lawyers are partnering together to provide top level representation for those impacted by the garden grove chemical spill. ""this is a…",2026-05-25 18:04:00+00:00,https://www.prnewswire.com/news-releases/acts-law-becker-law-group-nguyen-lawyers-partner-together-in-fight-for-garden-grove-chemical-spill-victims-302781263.html,18,2026-05-25
thechalkboardmag.com,cameron lee,"living well with jessica bragdon, co-founder of koala eco: why clean living starts at home","some of the links in this story are affiliate links, which means we may earn a commission if you choose to purchase—helping us continue to share mindful, inspiring content.
long before “clean living” became mainstream, jessica bragdon was thinking deeply abou…",2026-05-25 18:01:36+00:00,https://thechalkboardmag.com/living-well-jessica-bragdon-koala-eco-clean-living/,18,2026-05-25
nbc news,daniella silva,cbs backs off effort to stop sharing of colbert’s surprise ‘only in monroe’ segment amid backlash,"cbs said it had issued copyright notices for a recent episode featuring a surprise appearance by stephen colbert on the show “only in monroe” per its regular practice, but would stop issuing takedown notices pending further review.",2026-05-25 18:01:33+00:00,https://www.nbcnews.com/pop-culture/pop-culture-news/cbs-backs-effort-stop-sharing-colberts-surprise-only-monroe-segment-ba-rcna346809,18,2026-05-25
hollywood reporter,etan vlessing,canada tripling netflix tax u.s. streamers draws skepticism,"more money may be squeezed from foreign digital platforms, but there's concern it won’t subsidize dramas, docs and other content local actors, directors and creative teams depend on for work.",2026-05-25 18:00:52+00:00,http://www.hollywoodreporter.com/tv/tv-news/canada-netflix-tax-us-streamers-1236605464/,18,2026-05-25
usa today,"larry bohannan, palm springs desert sun",historic california event (and others) waiting for pga tour's verdict,"the la quinta tournament has dates for 2027, but nothing is certain for 2028",2026-05-25 18:00:36+00:00,https://golfweek.usatoday.com/story/sports/golf/pga/2026/05/25/historic-california-event-waiting-for-pga-tour-verdict/90250146007/,18,2026-05-25
nakedcapitalism.com,nat wilson turner,"coffee break: resistance meets reaction, pope, pension funds, data centers, trump crypto edition","the american technocracy is using corruption, media manipulation, and sectarianism to crush popular (and papal) resistance.",2026-05-25 18:00:13+00:00,https://www.nakedcapitalism.com/2026/05/pope-leo-encyclical-cftc-crypto-kalshi-data-centers-larry-fink.html,18,2026-05-25
new zealand herald,rafaella melo,hastings barber retires after six decades: ‘that place keeps me sane’,the clippers are set to fall silent on june 5 when rex harding's shop closes.,2026-05-25 18:00:01+00:00,https://www.nzherald.co.nz/hawkes-bay-today/news/hastings-barber-retires-after-six-decades-that-place-keeps-me-sane/i4cqsst3pnb3rhayf57tdyebhu/,18,2026-05-25
dev.to,chris lloyd abot fallaria,how i built a production-ready voucher management system with laravel 12 and vue 3,the problem   i'm a bs information technology student in the philippines. during my time...,2026-05-25 18:00:00+00:00,https://dev.to/chrislfallaria/how-i-built-a-production-ready-voucher-management-system-with-laravel-12-and-vue-3-3dl0,18,2026-05-25
cheezburger.com,"jesse kessenheimer, jesse kessenheimer","phd student lives with her friend and pays $200/mo for a room, but refuses to clean because she doesn't “own” the house: ‘i think living nearly rent-free should inspire some level of communal care’","despite the seriously discounted roommate rent, this entitled phd student didn't feel like she had to pull her weight with household chores. 
why? because she didn't technically or legally own the house, her friend did. 
roommates are supposed to shoulder t…",2026-05-25 18:00:00+00:00,https://cheezburger.com/45387269/phd-student-lives-with-her-friend-and-pays-200mo-for-a-room-but-refuses-to-clean-because-she-doesnt,18,2026-05-25
oilprice.com,oilprice.com,data centers are outgrowing europe’s clean power deals,"european data center power purchase agreement (ppa) volumes fell from 4.2 gigawatts (gw) in 2024 to 2.6 gw in 2025, even as capacity buildout accelerated sharply. the drop reflects offshore wind delays and increased challenges in agreeing on ppa price points …",2026-05-25 18:00:00+00:00,https://oilprice.com/energy/energy-general/data-centers-are-outgrowing-europes-clean-power-deals.html,18,2026-05-25
comicbook.com,marco vito oddo,"on this day, 3 of the most important sci-fi movies ever made all released & changed cinema history","image courtesy of lucasfilm

every year, dozens of science fiction movies reach theaters or streaming platforms, the overwhelming majority of them vanishing within weeks of opening. however, a select few films are so revolutionary that they force studios to r…",2026-05-25 18:00:00+00:00,http://comicbook.com/movies/feature/on-this-day-3-of-the-most-important-sci-fi-movies-ever-made-all-released-changed-cinema-history/,18,2026-05-25
the irish times,stephen bourke,labour court member in unfair dismissal claim against state,veteran of 18-and-a-half years service pursuing a complaint at the workplace relations commission against minister for enterprise,2026-05-25 17:56:01+00:00,https://www.irishtimes.com/business/2026/05/25/labour-court-member-in-unfair-dismissal-claim-against-state/,17,2026-05-25
theflightdeal.com,the flight deal,"jetblue: new york – las vegas, nevada (and vice versa). $273 (basic economy) / $383 (regular economy). roundtrip, including all taxes",a good sale for nonstop service to/from las vegasthe $383 fare is a regular economy fare that allows for normal size carry-on and a personal item in addition to advance seat assignment.jetblue,2026-05-25 17:53:12+00:00,https://www.theflightdeal.com/2026/05/25/jetblue-new-york-las-vegas-nevada-and-vice-versa-273-basic-economy-383-regular-economy-roundtrip-including-all-taxes/,17,2026-05-25
royal gazette,jonathan kent,bma licence enables plume to launch first onchain regulated vault,"a bermudian company has launched what it describes as the world’s first regulated onchain vault, increasing accessibility to global investments for people who lack a brokerage account.
plume, an open ...",2026-05-25 17:53:07+00:00,https://www.royalgazette.com/international-business/business/article/20260525/bma-licence-enables-plume-to-launch-first-onchain-regulated-vault/,17,2026-05-25
syllad.com,syllad | the rising meghalaya,illegal bike taxi operations face crackdown; meghalaya govt urges aggregators to register,the state government has reiterated that enforcement action is being taken against illegal two-wheeler taxi aggregators and urged operators to comply with notified rules before running services. commissioner & secretary sanjay goyal on monday said the departm…,2026-05-25 17:51:26+00:00,https://www.syllad.com/illegal-bike-taxi-operations-face-crackdown-meghalaya-govt-urges-aggregators-to-register/,17,2026-05-25
the irish times,barry o'halloran,regulators clear kingspan takeover of duggan division,"deal will not substantially lessen competition, says mergers watchdog",2026-05-25 17:46:43+00:00,https://www.irishtimes.com/business/2026/05/25/regulators-clear-kingspan-takeover-of-duggan-division/,17,2026-05-25
twistedsifter.com,michael levanduski,son snaps at his overbearing father during a high-stress apartment hunt—then faces a massive wave of family guilt,"the relationship between father and son needs to evolve as kids grow up.
the post son snaps at his overbearing father during a high-stress apartment hunt—then faces a massive wave of family guilt appeared first on twistedsifter.",2026-05-25 17:46:34+00:00,http://twistedsifter.com/2026/05/son-snaps-at-his-overbearing-father-during-a-high-stress-apartment-hunt-then-faces-a-massive-wave-of-family-guilt/,17,2026-05-25
financial post,business wire,wcb workers sound alarm on rising workloads and delays in care for injured canadians,"vancouver, bc — when canadians are injured on the job, they depend on the expertise and dedication of workers at the workers’ compensation boards (wcbs) across the country. but as workloads intensify and staffing pressures mount, those same workers are warnin…",2026-05-25 17:46:14+00:00,https://financialpost.com/pmn/business-wire-news-releases-pmn/wcb-workers-sound-alarm-on-rising-workloads-and-delays-in-care-for-injured-canadians,17,2026-05-25
nintendo life,nintendo life,gamemill's snoopy game has been hit with a copyright lawsuit,"pay peanuts.we don't remember the snoopy storyline where charlie brown and co. end up in a legal copyright battle, but that's exactly what's happening at the moment. lee mendelson film productions (the owner of ""certain intellectual property"" related to the p…",2026-05-25 17:45:00+00:00,https://www.nintendolife.com/news/2026/05/gamemills-snoopy-game-has-been-hit-with-a-copyright-lawsuit,17,2026-05-25
the times of india,pti,shipping ministry working on reform-driven roadmap to accelerate maritime transformation,india's shipping ministry is driving a major maritime transformation. a new roadmap focuses on better governance and ease of doing business. officials are tasked with faster resolution of pending issues and grievances. a digital platform and mobile app will s…,2026-05-25 17:44:00+00:00,https://economictimes.indiatimes.com/industry/transportation/shipping-/-transport/shipping-ministry-working-on-reform-driven-roadmap-to-accelerate-maritime-transformation/articleshow/131314962.cms,17,2026-05-25
prnewswire,unknown,american alternative assets publishes 2026 precious metals ira account guide as gold hits record highs and retirees seek inflation protection,"comprehensive resource breaks down fee structures, custodian comparisons, and irs rules amid growing demand from americans aged 45-65 reassessing retirement strategy woodland hills, calif., may 25, 2026 /prnewswire/ -- american alternative assets, a leading p…",2026-05-25 17:42:00+00:00,https://www.prnewswire.com/news-releases/american-alternative-assets-publishes-2026-precious-metals-ira-account-guide-as-gold-hits-record-highs-and-retirees-seek-inflation-protection-302781252.html,17,2026-05-25
bbc news,nick mashiter - football reporter,forest must keep stars to progress - pereira,"nottingham forest will fight to keep morgan gibbs-white and elliot anderson, with vitor pereira insisting they need to continue to build. the duo will be in-demand this summer with manchester city and manchester united interested in england midfielder anderso…",2026-05-25 17:41:40+00:00,https://www.bbc.com/sport/football/articles/c1422lxgepro?xtor=al-72-%5bpartner%5d-%5byahoo.north.america%5d-%5bheadline%5d-%5bsport%5d-%5bbizdev%5d-%5bisapi%5d,17,2026-05-25
the times of india,et bureau,"pep talk for the ages, control, with trust","pep guardiola has left manchester city after a decade of success. he won 20 major trophies, including the champions league. guardiola is known for his tactical genius and leadership style. he adapted his approach at barcelona, bayern munich, and manchester ci…",2026-05-25 17:38:42+00:00,https://economictimes.indiatimes.com/opinion/et-editorial/pep-talk-for-the-ages-control-with-trust/articleshow/131314058.cms,17,2026-05-25
protothema.gr,admin,"anti-vaxxers, drachma supporters and putin followers in maria karystianou’s “hope” party – the people supporting her","attendees from the families of tempi victims were absent from the “olympion” – “russian influences” in the front row – and reactions over alleged copyright theft!
the post anti-vaxxers, drachma supporters and putin followers in maria karystianou’s “hope” part…",2026-05-25 17:38:41+00:00,https://en.protothema.gr/2026/05/25/anti-vaxxers-drachma-supporters-and-putin-followers-in-maria-karystianous-hope-party-the-people-supporting-her/,17,2026-05-25
the times of india,surya ramkumar,from stability to chaos: why individuals must now think like institutions,"the modern world demands individuals possess institutional competence as complexity shifts from stable structures to personal navigation.  life's increasing interconnectedness and uncertainty require individuals to adopt strategic clarity, intentional resourc…",2026-05-25 17:38:10+00:00,https://economictimes.indiatimes.com/opinion/et-commentary/from-stability-to-chaos-why-individuals-must-now-think-like-institutions/articleshow/131314786.cms,17,2026-05-25
the times of india,et bureau,unplug dead psus ps bureaucratic zzz,india's government struggles to close ailing state-owned companies. bureaucratic hurdles and complex asset sales delay closures. this ties up vital capital. streamlining exit processes is crucial for attracting foreign investment. the government aims to show …,2026-05-25 17:37:40+00:00,https://economictimes.indiatimes.com/opinion/et-editorial/unplug-dead-psus-ps-bureaucratic-zzz/articleshow/131314046.cms,17,2026-05-25
overcomingbias.com,robin hanson,toward-forager predictions,in my last post i reported:,2026-05-25 17:37:27+00:00,https://www.overcomingbias.com/p/toward-forager-predictions,17,2026-05-25
hackyexperiments.com,bilal tahir,the coming layoffs and the revenge of the measurers,"ai is gutting the middle of the org chart first. the cuts, the inequality runaway, and why proactive ubi is the only way through the backlash.",2026-05-25 17:35:34+00:00,https://hackyexperiments.com/blog/the-revenge-of-the-measurers,17,2026-05-25
the times of india,sanjeev krishan,four myths about the falling rupee and what india must actually do,india's rupee is facing pressure from global events.  the nation needs a plan to tackle weaknesses that amplify these impacts.  energy independence and boosting domestic manufacturing are key.  strengthening talent mobility and improving fta utilization are a…,2026-05-25 17:35:00+00:00,https://economictimes.indiatimes.com/opinion/et-commentary/four-myths-about-the-falling-rupee-and-what-india-must-actually-do/articleshow/131313898.cms,17,2026-05-25
"hitc - football, gaming, movies, tv, music",filipe guedes,former navy seal gives conor mcgregor gift from osama bin laden mission,"conor mcgregor has always found a way to stay in the spotlight, but his confirmed ufc return during the international fight week, after five years, has put him back at the centre of attention. this time, the focus is feeding straight into business.",2026-05-25 17:34:49+00:00,https://www.hitc.com/former-navy-seal-gives-conor-mcgregor-gift-from-osama-bin-laden-mission/,17,2026-05-25
livemint,eshita gain,itr filing 2026: how to e-verify your return? 5 key points to know,"as taxpayers prepare to file income tax returns, e-verification is essential for validity. failure to e-verify may result in penalties or delayed refunds. details here.",2026-05-25 17:33:40+00:00,https://www.livemint.com/money/personal-finance/itr-filing-2026-how-to-e-verify-your-return-5-key-points-to-know-11779728103216.html,17,2026-05-25
socialmediaexplorer.com,headlines team,how chinedum ndukwe projects are expanding access to affordable housing in cincinnati,"affordable housing remains one of the most pressing development challenges facing cincinnati. rising construction costs,...
the post how chinedum ndukwe projects are expanding access to affordable housing in cincinnati appeared first on social media explorer.",2026-05-25 17:30:43+00:00,https://socialmediaexplorer.com/business-innovation-2/how-chinedum-ndukwe-projects-are-expanding-access-to-affordable-housing-in-cincinnati/,17,2026-05-25
makeuseof,saikat basu,wikipedia may have built the best ai writing detection guide,this wikipedia page is the ai detection tool you didn't know existed.,2026-05-25 17:30:18+00:00,https://www.makeuseof.com/wikipedia-best-ai-writing-detection-guide/,17,2026-05-25
roanoke times,daryl austin special to usa today,"candy, clothing, and community: how the general store shaped retail","long before crowded shopping malls and overnight deliveries became the norm, everyday commerce in america moved at a much slower, more intimate pace.",2026-05-25 17:30:00+00:00,https://roanoke.com/news/nation-world/business/article_0b1b18f9-da1e-503d-9ff5-d09501fb9a77.html,17,2026-05-25
english premier league index - opta stats,epl index,report: spurs reach agreement to sign 29-year-old premier league star,tottenham transfer news: de zerbi moves fast after premier league survivalspurs survival opens door to summer rebuildtottenham’s 1-0 win over everton on the final day did more than preserve premier ...,2026-05-25 17:30:00+00:00,https://eplindex.com/146805/spurs-reach-agreement-to-sign-29-year-old-premier-league-star.html,17,2026-05-25
paxnews.com,michael pihach,homecoming: marsha mowers returns to reach global marketing as pr manager,"some things have a way of coming full circle. and for marsha mowers, this is one of them. the toronto-based communications pro – known to many travel advisors from her years as a reporter and editor in the travel trade media – is returning to the pr side of t…",2026-05-25 17:29:37+00:00,https://www.paxnews.com/news/appointments-jobs/homecoming-marsha-mowers-returns-reach-global-pr-manager,17,2026-05-25
pypi.org,dev@achek.com.ng,achek 2.0.1,"official python sdk for achek — whatsapp otp, ai chatbots & business messaging for nigeria",2026-05-25 17:28:40+00:00,https://pypi.org/project/achek/2.0.1/,17,2026-05-25
